{
  "schemaVersion": "2.6",
  "profileId": "0x6666666666666666666666666666666666666666666666666666666666666666",
  "seedId": "0x7777777777777777777777777777777777777777777777777777777777777777",
  "network": "ethereum-sepolia",
  "policy": {
    "requiredShares": 2,
    "totalShares": 4,
    "authorizedViewersRoot": "0x8888888888888888888888888888888888888888888888888888888888888888"
  },
  "createdAt": "2026-04-18T00:00:00Z"
}
